text,label
Data443 Announces New Trading Symbol  https://t.co/CcH9VQUzQq,2
David Rolfe Adds 2 Tech Stocks to Portfolio in 3rd Quarter,2
Delayed debut for all-electric Ferrari,2
Demonstrator contract for Franco-German fighter jet project expected by Jan,2
Dicerna inks deal with Novo Nordisk for liver-related cardio-metabolic diseases,2
Did Amazon finally have its iPhone moment? @JimCramer talks one-day shipping and what it meant for #StockoftheDay... https://t.co/zfeRpY7NNk,2
Dimerix : Holds Pre-IND Meeting on DMX-200 With FDA #Dimerix #Stock #MarketScreener https://t.co/O0AKK9FS38 https://t.co/vcut3h8fJJ,2
Direct Lenders Stay in Vogue as Fundraising Tops $23 Billion,2
Disney is giving us Baby Yoda toys for Christmas https://t.co/5sFXnLp63J,2
Disney Is Ready to Drop a Bomb on Netflix in This Huge Market,2
Disney sees $100M 'Frozen 2' debut; Rosenblatt boosts target,2
Disney Streaming Boss Kevin Mayer: App Architecture to Blame for Disney Plus Stumbles - Nasdaq,2
Disney+ to debut late March in France in exclusive deal with Canal+,2
DOMTAR CORPORATION COMMUNIQUE LES RÉSULTATS PRÉLIMINAIRES DE SON QUATRIÈME TRIMESTRE ET DE SON EXERCICE 2019,2
"Dragon Seats Enters Partnership to Provide Custom, Heated Benches for XFL’s DC Defenders",2
Dragonfly collaborates with Abbvie for autoimmune diseases and oncology,2
Duke Energy prices 25M equity offering,2
Dunkin' Teams with Beyond Meat Ambassador Snoop Dogg for Clothing Line,2
Duxton Broadacre Farms : Changes relating to buy-back - Appendix 3D #DuxtonBroadacreFarms #Stock #MarketScreener… https://t.co/6IoVwrIEHz,2
Dynatrace Announces Pricing of Follow-On Offering By Selling Stockholders https://t.co/RU85lpY5mQ https://t.co/JOOMOIKPeo,2
"EasyJet seeks to ""do the right thing"" offsetting emissions, critics say fly less",2
EBay eliminates sneaker selling fees for first time,2
ECA Marcellus Trust I Announces Receipt of Notice from NYSE Regarding Continued Listing Standards,2
Ecolab Named to CDP Water Security A List for Sustainable Water Management,2
Ekso launches upgraded cloud platform to support use of exoskeleton,2
Electric-Car Onset Leaves Lubricant Industry Facing Kodak’s Fate,2
Eli Lilly : Reyvow Migraine Treatment Available for Prescription Use #EliLillyand #Stock #MarketScreener… https://t.co/8l20k7DcPy,2
"Elon Musk says Tesla has 146,000 orders for its Cybertruck, less than 48 hours after the broken-glass reveal https://t.co/yzgK4mbBTB",2
elumeo : to close its site in Rome (pdf) #elumeo #Stock #MarketScreener https://t.co/3x3PYyHfKB https://t.co/ZUs0WizSz9,2
Embraer sells six jets at Dubai Airshow - Day 2,2
Emerson’s New Virtual Reality Simulation Improves Workforce Safety and Speeds Training,2
Emirates announces $16 billion order for 50 Airbus A350 planes,2
Emirates close to buying 30 Boeing 787 in fleet compromise deal -sources,2
Emirates Pares Back Wide-Body Airbus Order Amid Fleet Review,2
Encana shareholder to vote against move out of Canada,2
Encounter Resources : AGM Chair Address and Presentation #EncounterResources #Stock #MarketScreener… https://t.co/kptkwzjKfZ,2
Endologix Announces Preliminary Financial Results and Conference Call for Fourth Quarter and Full-Year 2019,2
Energy Pipeline Firm Takes $4 Billion Private Equity Buyout,2
E-Porsche auf Eispiste: Das Rennsport-Comeback des Porsche-Erben,2
EPR Properties sells Charter School portfolio for $454M; lowers FFO guidance for 2019,2
Equinor broadens scope of carbon targets to match rivals,2
Equinox Wins Silver Lake Funds to Help Take Aim at Peloton,2
Ericsson Pulls Out of Biggest Mobile Event Due to Virus,2
Ericsson Pulls Out of Biggest Mobile Industry Event Due to Virus,2
Ericsson withdraws from MWC on coronavirus worries,2
"Eskom, which accounts for two-fifths of South Africa’s greenhouse-gas emissions, leads the country’s biggest emitte… https://t.co/eC3HUwQDgf",2
"ESR Cayman : PARTIAL EXERCISE OF THE OVER-ALLOTMENT OPTION, STABILIZING ACTIONS AND END OF STABILIZATION PERIOD… https://t.co/za2DQn3iV7",2
"Estre Ambiental : to Hold its Annual General Meeting on December 20, 2019 #EstreAmbiental #Stock #MarketScreener… https://t.co/AFFuNakugw",2
Eudonet annonce un chiffre d’affaires récurrent en hausse de 32% pour l’année 2019,2
Europe Pushes on With Gigafactory Plan to Rival Tesla,2
Europe Pushes on With Gigafactory Plan to Rival Tesla and China,2
Exclusive: China's BAIC raising Daimler stake to unseat Geely as top shareholder - sources,2
Exclusive: China's mobile giants to take on Google's Play store - sources,2
"Exclusive: Fearing Huawei curbs, Deutsche Telekom tells Nokia to shape up",2
Executives at SoftBank are looking for a way to reduce the size of a $3 billion offer for WeWork stock as part of i… https://t.co/4kqz2W0yhz,2
Exelon : Initial Statement of Beneficial Ownership #Exelon #Stock #MarketScreener https://t.co/3h1IS0vjXb https://t.co/Oy6iFfT8bE,2
Expanded use of J&J's Darzalex OK'd in Europe,2
Ex-Stanhope Capital execs land $600m in launch of new firm Eighteen48 Partners,2
Extraordinary/ Special General Meeting::Voluntary #Shinvest #Stock #MarketScreener https://t.co/vuSekbMzhb https://t.co/dAHCFxPXHG,2
Exxon and Chevron Targeted by Climate-Activist Shareholder Group,2
"Facebook Bans All Content On Vaccine Awareness, Including Facts About Vaccine Ingredients https://t.co/uwwXUaxFCY",2
Facebook co-founder eyes direct listing for Asana https://t.co/d2k631l6Ac,2
Facebook Is Not Making A Key Public Relations Point,2
Facebook is resisting Attorney General William Barr's calls to delay rollout of encryption technology across its pl… https://t.co/k2SzZ2zsLi,2
Facebook rejects AG Barr's request to stop encryption plans for messaging apps https://t.co/Tkyy7abxUi,2
"Fake doctors, misleading claims drive OxyContin China sales",2
Fantasia : FURTHER INFORMATION IN RELATION TO THE CO-OPERATION AGREEMENT WITH SHENGYUAN  #Stock #MarketScreener… https://t.co/NkBhcbaRvs,2
Fat Prophets Pty : FPP Non-Renounceable Rights Issue #FatProphetsPty #Stock #MarketScreener https://t.co/JkAT9QHgBz https://t.co/dQoC6XqvKv,2
FDA extends action date for Blueprint's avapritinib,2
FDM : AFL-CIO Endorses USMCA After Successfully Negotiating Improvements #FDM #Stock #MarketScreener… https://t.co/Ja3PJ0uKZB,2
FDM : Beyer Statement On Announced USMCA Agreement #FDM #Stock #MarketScreener https://t.co/wCCSVghill https://t.co/ghfv2COBGO,2
FedEx pension plan will close to new hires as company bumps up 401(k) match,2
Fiat Chrysler is in the process of two crucial negotiations at the same time. It needs each set of talks to go well… https://t.co/6aU0faZuf3,2
Fiat looks to thread the needle with UAW deal,2
Fiera Milano : and allestimenti Benfenati sign a business partnership to maximise synergies #FieraMilano #Stock… https://t.co/qcUBTf8snL,2
Fletcher Building : Notice of on-market share buyback #FletcherBuilding #Stock #MarketScreener… https://t.co/Fvme3Y97pD,2
FMCSA Increases Random Drug Testing Rate To 50%,2
"For a time, Uber helicopter rides from Manhattan to JFK Airport were cheaper than its cars https://t.co/Q2f8n7dJQL",2
Forager Funds Management Pty : Indicative NAV COB 22/11/2019 #ForagerFundsManagementPty #Stock #MarketScreener… https://t.co/zNYWZlWYdu,2
Ford and McDonald's are turning coffee waste into car parts https://t.co/uIP4HPHyn9 https://t.co/qKnCKGMXrk,2
Ford confirmed its new electric SUV will be called the Mustang Mach-E ahead of a debut event in Los Angeles. More d… https://t.co/DDZ2cDhzRz,2
Ford is mortgaging its future on the value of its past,2
Ford Mustang Mach-E: The first all-electric Ford is here,2
Ford releases first electric car - a Mustang SUV,2
"Ford reveals new electric SUV, Mustang Mach-E",2
Ford to nearly halve its 2018 before interest and taxes loss in China https://t.co/SULE0vdZhE https://t.co/mZcVGtnFRN,2
"Form 8.3 - The Vanguard Group, Inc.: Just Eat plc #JEOL #Stock #MarketScreener https://t.co/8L1jtGW1Jo https://t.co/4MYhJInOKz",2
"Former Celadon Employees, Drivers Describe Chaos After Abrupt Bankruptcy Filing",2
Former PayPal CFO has bank account closed without warning,2
Fox Says Super Bowl Ads Sold Out at Record $5.6 Million Each,2
Fox Sports has sold out its inventory of Super Bowl ads https://t.co/wpGQ9cClj4,2
Foxconn delays return to Shenzhen facility,2
FPT Industrial signs MoU with Microvast,2
French Connection : Form 8.5 (EPT/RI) (pdf) #FrenchConnection #Stock #MarketScreener https://t.co/5nuRSLzSEC https://t.co/Gt8EWF8Omq,2
From the Beltway to Bondi — Our @Nasdaq employees around the world are committed to hours of service with… https://t.co/leYgfCIHxS,2
'Frozen 2' Sets Another Box Office Record For Disney This Year,2
Funko opens new store in Hollywood,2
Gaige Keep: A Former Marine Sergeant-Turned-Marketing Guru Sheds Light On Building A Personal Brand,2
Galileo Mining : Copper - Gold Drilling Underway at Norseman Prospects #GalileoMining #Stock #MarketScreener… https://t.co/QbtwRsIFEP,2
Galp Energia SGPS : Who Pays the Tax on Imports from China? #GalpEnergiaSGPS #Stock #MarketScreener… https://t.co/QnLyXcgLUr,2
Garmin : Response Team Rescues Imperiled Animals in the Backcountry #Garmin #Stock #MarketScreener… https://t.co/jjLkp0gVRG,2
Gartner Guides Light After Ending 2019 on a High Note,2
Gazprom proposes one-year gas transit deal with Ukraine,2
GE may not be crushed by Boeing's 737 Max production halt,2
General Motors to invest $1.5 billion in Missouri plant,2
Generate Capital raises $1bn of LP capital for infra investment,2
GHO Capital pulls in €975m to close Europe’s ‘largest healthcare fund’,2
Global Investments : Daily Share Buy Back Notice #GlobalInvestments #Stock #MarketScreener https://t.co/f9AFWThVVF https://t.co/sjBHtwCINn,2
Global Self Storage starts rights offering,2
Goldman expands company research as other retrench - Bloomberg,2
Goldman Sachs invests over $100M in ‘Launch with GS’,2
Goldman Sachs unveils internal campaign on use of gender identity pronouns #economy #MarketScreener… https://t.co/DlaISiZU1l,2
GoldON Resources : Grants Incentive Stock Options #GoldONResources #Stock #MarketScreener https://t.co/NSJSFEXYPN https://t.co/w9eP0xA6r1,2
"Goldrea Negotiating Land Package Deal in Dixie Lake, Ontario  https://t.co/rldbTOfhYL",2
Google Assistant launches personalized news playlists,2
Google employees demonstrated outside the company’s San Francisco office Friday to protest the internet giant’s rec… https://t.co/pgD27oIPWc,2
"Google has announced new limits on political advertising, but the decision raises broad questions about what types… https://t.co/ML0m6zOtF6",2
"Google launched its cloud gaming service Stadia this week, but is it any good? https://t.co/IElF2d1BUY",2
"Google Maps seeks business, transit reviews in new look as it turns 15",2
Google rolls out interpreter to mobile,2
Google wants Cloud dominance by 2023 - report,2
Google Workers Rising Up After Employees Are Fired,2
Grayscale Bitcoin Trust files registration statement with SEC,2
Great Wall Motor and BMW move forward with JV,2
"Greenlane Renewables Signs New $7.0 Million System Supply Contract with the Renewable Natural Gas Company, a Leader in Landfill Gas to RNG Projects",2
"Greenleaf Foods, SPC, and Purple Carrot Partner to Deliver New Plant-based Protein Options to Customers Nationwide",2
"Grifols : December 6, 2019 Grifols presents its latest Alzheimer's clinical trial data #Grifols #Stock… https://t.co/Dnt4oYb4SP",2
Grubhub founder: ‘I am not staying up at night dreaming about consolidation’,2
GS Acquisition : Vertiv Announcement Call Presentation #GS #Stock #MarketScreener https://t.co/AB1CLG5Hfa https://t.co/St0OvagWyy,2
GS Acquisition : Vertiv Investor Presentation #GS #Stock #MarketScreener https://t.co/IJRFVMfzWQ https://t.co/PyBD2UBrlD,2
GSX Techedu announces public offering by selling shareholders,2
Guggenheim Partners LLC : GGM November 2019 Section 19a-1 Letter #GuggenheimPartnersLLC #Stock #MarketScreener… https://t.co/k9wynCnbDb,2
H.I.G. Realty Partners Lends $33.1 million on Denver Metro Industrial/Flex Office Portfolio,2
"Halliburton layoffs driven by 'stark reality' of energy pricing, CFO says",2
Hallmark Pulls Gay-themed Ads,2
"Hallmark Pulls Kissing Brides, and Netflix, DeGeneres Push Back",2
Hallmark Pulls Wedding Ads Featuring Two Brides Kissing,2
Hancock Capital collects $380m for sixth mezzanine fund to follow debut co-invest vehicle close,2
Harbor Capital Advisors Launches Six New Harbor Funds https://t.co/hMB4nbWKhZ https://t.co/PffVsEZfXE,2
Has The Global Slowdown Affected Ford’s South America’s Volumes?,2
Hawaiian Airlines reports January traffic,2
Hawaiian Electric aims to be 100% renewable energy by 2045 Watch an energy focused #NYSESlice interview with… https://t.co/A4gAYCbTQo,2
Heard on the Street: Tiffany accepts a sparklier proposal https://t.co/CXZo603aGo,2
Here’s the Deal: A Sneak Peek at Amazon’s Biggest Cyber Monday Deals Weekend Ever,2
Here's How Disney+'s 28.6 Million Subscribers Compare to Netflix,2
Here's what @ElonMusk's '200K' tweet is likely hinting at when it comes to the Tesla $TSLA Cybertruck https://t.co/6Me6AP1CCJ,2
Here's what WeWork must do to stay alive https://t.co/FCwWmKD3zq via @bopinion,2
Hermes GPE raises $603.5m for PEC IV alongside $1bn BTPS mandate,2
Herro Says He's Committed to Credit Suisse But Rohner Should Quit,2
Hexagon Resources : Shareholders Approve Rare Earth Investment #HexagonResources #Stock #MarketScreener… https://t.co/u3JbQwdgFt,2
"Hexo Reported Unlicensed Cannabis, Schedules It For Destruction",2
HIG continues busy fundraising year by closing $3.1bn mid-market buyout vehicle,2
Highlight: 'When you look at what Amazon has built... it's this infrastructure and this user base... that allows them t... https://t.co/VuiDadXgcf,2
Highwoods Properties : SCHEDULE 13G #HighwoodsProperties #Stock #MarketScreener https://t.co/bdcgJzRYno https://t.co/o3ZStbEDGQ,2
HKScan Corporation: SHARE REPURCHASE 25.11.2019 #Stock #MarketScreener https://t.co/OGGSEI9W1K https://t.co/QE44vMzmLn,2
"Horizon Media Study Finds Instagram’s Move to Hide Likes is Somewhat of a Collective Shrug, but with a Glimmer of H… https://t.co/gxnZp3H5lh",2
How Comcast and Charter Have Used Cellphone Services to Sell Wifi,2
How Huawei became a U.S. government target https://t.co/K1hHx6Uw5b,2
"How Much Does Costco Spend On Selling, General And Administrative Expenses?",2
How T-Mobile CEO John Legere Changed the Industry,2
Hoxton Ventures ups goal for sophomore fundraise after powering towards initial target,2
"HP Is Playing Hard To Get, But Its Rejection Could Lead To Proxy Wars",2
HP Sends Letter to Xerox  https://t.co/ceqjDE3fK7,2
HSBC Bank USA rolls out real-time payments to business clients,2
HSBC cashes in some chips on Rockwell Automation,2
HSBC Plans Third Overhaul in a Decade With Investors Seething,2
Huawei gets 90-day extension for doing business with U.S. companies,2
Huawei gets reprieve to do business with US companies: Exclusive,2
Huawei granted 90-day extension to do business with U.S. companies,2
"Hundreds of Nike employees march to protest its treatment of women, reports https://t.co/iuqjWaEFen",2
Hyderabad Metro Rail Becomes The Second-Largest Operational Metro Network In The Country,2
i3 Energy : Price Monitoring Extension #i3Energy #Stock #MarketScreener https://t.co/LbE6Xm8iZX https://t.co/ST9Mdc8Bmi,2
IBM Has Its Head In The Clouds,2
"IBM: one free cloud (and a free ton of copper) with every purchase of cloud

what happens to AWS margins now?",2
"ICYMI: Actually, Teslas are among the *least* stolen vehicles. https://t.co/xm4JaVF88s",2
IDG Energy Investment : VOLUNTARY ANNOUNCEMENT INVESTMENT REGARDING MOBILITY SERVICES PLAT... #IDG #Stock… https://t.co/32MT3bB1OC,2
IGL: Strategic Acquisition of Salmat Marketing Solutions #Salmat #Stock #MarketScreener https://t.co/I2ddCrNdik https://t.co/bgGx6OKoTE,2
Ilkka-Yhtymä Oyj: Johdon liiketoimet #Stock #MarketScreener https://t.co/Je2UYbTKuP https://t.co/CLCJGNePOA,2
Impossible Dream? Uber Aims At Profitability In 2020,2
"In a High-Stakes Labor Showdown, McDonald’s Has Allies in the White House",2
"In this #CNBCClassic clip, Jeff Bezos explained his ambitious vision for Amazon in a 1999 interview: ""There’s no gu… https://t.co/mxAWKJvdVb",2
India Asks IndiGo to Gradually Ground Unmodified A320neo Planes,2
India’s aviation regulator asks an airline to ground one unmodified Airbus A320neo for every new addition to its fl… https://t.co/9N4YSMliaG,2
"Insiders Know Best? What Employee Ratings Reveal About Aurora Cannabis, Canopy Growth, and Cronos Group",2
Instagram is willing to pay for celebrities’ IGTV production costs — as long as they avoid politics or elections https://t.co/kqBu6ZwK1g,2
Instagram Stories Already Generates 10% of Facebook's Ad Revenue,2
Intel : and MediaTek Partner to Deliver 5G on the PC #Intel #Stock #MarketScreener https://t.co/HlvJPpOWGC https://t.co/XlXcj71XjG,2
Intel : Autonomous Driving / Mobileye #Intel #Stock #MarketScreener https://t.co/tWTAmiT4c2 https://t.co/kmHBJumvdc,2
Intel and MediaTek Partner on 5G Laptops for 2021,2
Intel director acquires $5M in shares,2
"Internet Society Foundation Announces $300,000 in Grants for Projects That Promote the Benefits of the Internet",2
Interpublic CEO on competing with tech companies,2
Intertek : launches Cyber Assured #Intertek #Stock #MarketScreener https://t.co/uDrw45pqXr https://t.co/ahw2QkSvPe,2
InVivo Therapeutics launches equity offering,2
IPG Team Selected as Global Marketing Agency for LATAM Airlines  https://t.co/keAVow1kX2,2
"iPhone Maker Foxconn Makes Masks For Chinese Employees, Forces Them To Return To Work",2
IPhone Maker Foxconn Warns Staff to Keep Away From Shenzhen Base,2
Iridium Communications Extends Its Internet of Things Coverage Globally,2
IRS investigators scrutinize Bitcoin ATMs and kiosks,2
Is Amazon $AMZN grocery in the trial-and-error stage? https://t.co/wdNqRCAV1s,2
Italy’s newest attempt to rescue failed airline Alitalia has one main objective: rope in German carrier Lufthansa https://t.co/JyuSAwUSLc,2
J&J launches innovative study for expanded use of Invokana,2
J&J retests baby powder days after asbestos finding,2
J.C. Penney redesigns its denim brand for size inclusivity,2
Jacobs wins cyber crime and training contract,2
James A. Balfanz Named CEO of City Year  https://t.co/grrygcvywi,2
Japan’s Friendship Ties Programs JENESYS 2019 ASEAN Inbound Program 23rd Batch,2
Jarvis Securities : Director's Interest #JarvisSecurities #Stock #MarketScreener https://t.co/JWKcET9MXw https://t.co/ma4z6I1Bxb,2
Jasper Therapeutics Launches with $35 Million Series A Financing to Develop and Commercialize Innovative Conditioni… https://t.co/QiiqQYWBXX,2
Jatenergy : Letters to Securityholders - Rights Issue #Jatenergy #Stock #MarketScreener https://t.co/MX24abcdO4 https://t.co/fIU7fwFauZ,2
Jeff Bezos & Blue Origin satellite launch protest sustained by GAO,2
JEOL : Form 8.3 - https://t.co/erBSsYuL00 #JEOL #Stock #MarketScreener https://t.co/Lt8CXiXJDy https://t.co/yVehgWa695,2
JEOL : Form 8.5 (EPT/RI)- Just Eat plc AMENDMENT #JEOL #Stock #MarketScreener https://t.co/EzlnPgve80 https://t.co/Ymcgw5V8l8,2
JetBlue Founder Says New ‘Breeze Air’ on Track to Fly This Year,2
Jones Lang LaSalle Incorporated : JLL closes $15.15M sale of Charlotte-area retail buildin...… https://t.co/qyJtU6T2lW,2
JPMorgan restructures ETF sales,2
Juiced Bikes Scorpion Is An E-Bike With A Motorcycle Spirit,2
Just Eat advises shareholders not to accept Prosus offer https://t.co/J9oWmkpJtW https://t.co/728Y7yTIci,2
Just Eat rejects raised offer from Prosus https://t.co/XHrs4GAofC https://t.co/v10dKf23AA,2
Just Eat urges shareholders to shun Prosus and stick with Takeaway deal,2
Karankawa Wind Farm Achieves Commercial Operation,2
Karelian Diamond Resources : Notice of meeting #KarelianDiamondResources #Stock #MarketScreener… https://t.co/kMhX3UU9b3,2
KBR wins $23.7M contract,2
"KFC is offering what's sure to be the hottest commodity of the season: a hunk of flammable, chicken-scented bliss k… https://t.co/kCXhrwbWAp",2
KLX Energy to implement cost cuts amid 'abrupt deterioration',2
Korian and Omedys Develop the First Neighborhood Teleconsultation Network in France,2
"Kroger wants to bring in shoppers by offering the freshest greens -- so fresh your kale, parsley or cilantro will b… https://t.co/EDeNh3Igdt",2
L BRANDS MEETING WITH BANKS TO CONSIDER ALTERNATIVES: THE DEAL... to the Victoria Secret show?,2
"L&T, IdeaForge Sign Pact For Unmanned Systems",2
L1 Long Short Fund : Net Tangible Asset Backing #L1LongShortFund #Stock #MarketScreener https://t.co/1NANQdyHCU https://t.co/4wvBuRi1pL,2
Landmark Partners pulls in $296m for sophomore infra fundraise,2
Larry Ellison Hits the High Seas With Endeavor in Sailing Deal,2
Latrobe Magnesium : Community Briefing for Latrobe Valley Magnesium Plant #LatrobeMagnesium #Stock #MarketScreener… https://t.co/Ve0JkYHFVY,2
"Layoffs Loom as Canadian Rail Strike Hits Chemicals, Farmers",2
LCI Industries lands Polyplastic,2
"Lee Enterprises plans quarterly call and webcast December 12, 2019  https://t.co/ruv27WLIPv",2
Legrand : Total Number of Shares and Voting Rights https://t.co/qrhAoTn3Z5 https://t.co/jZh8h52WOX,2
LHV : Loans of existing Danske Bank clients were transferred to LHV Pank #LHV #Stock #MarketScreener… https://t.co/bUPHzBuSMf,2
LIC Chairman MR Kumar Says There’s Hardly Any Stress To Impact Insurer’s Valuation,2
Lithium Americas to give up control of Argentina project,2
Lithium Consolidated : AGM Voting Clarification #LithiumConsolidated #Stock #MarketScreener https://t.co/p7a4RAogT6 https://t.co/qru0JbYXod,2
Lockheed awarded $3.3B to support satcom network,2
Lockheed's LM-100J scores FAA certification,2
Looking Through The Smoke To Altria’s Future,2
"Loss of Trust Led to Thiam's Exit, Credit Suisse Says",2
Low & Bonar : Form 8.5 (EPT/RI) - Low & Bonar PLC #LowBonar #Stock #MarketScreener https://t.co/ju6ZpIZD4Z https://t.co/mIgY63sHYY,2
Lowe's scheduled to report Q3 results before Wednesday's open,2
LSU Quarterback Joe Burrow Wins Heisman Trophy in Landslide Vote,2
"LSU Quarterback Joe Burrow Wins Heisman Trophy, AP Reports",2
Luckin Coffee buzzing and looking to the future,2
Luckin Coffee's Impressive Growth And Retail Model Could Dethrone Starbucks In China,2
Lyft pulls electric scooters from major cities,2
Macquarie : Ceasing to be a substantial holder for ELD #Macquarie #Stock #MarketScreener https://t.co/VBoCq46a73 https://t.co/L2eqF8hx9E,2
"Made in the new Shanghai Gigafactory, these Teslas have a starting price of 355,800 yuan ($50,623), making them abo… https://t.co/P9PkKIpvwA",2
Magmatic Resources : Appendix 3B #MagmaticResources #Stock #MarketScreener https://t.co/0yolhdScTL https://t.co/UUAn1nIln4,2
"Mahathir Shows No Sign of Handover of Power, Choice of Successor",2
Maire Tecnimont (BIT:MT) Use Of Debt Could Be Considered Risky,2
MAJOR TRANSACTION: SINGAPORE MRT TEL CONCESSION AGREEMENT #Stock #MarketScreener https://t.co/Zr8li1uwiL https://t.co/8lfAflCGp8,2
Malaysia's Mahathir clarifies comments on AirAsia,2
Marathon Patent stockholders approve share issuance for miner purchases,2
Marchex to Attend at Roth Corporate Access Event https://t.co/l9kObTTJFR,2
Markel Takes the Long-Term View After Another Impressive Year,2
Markforged Achieves ISO 27001 Certification,2
Marrone Bio Innovations : Control Invasive Mussel Biofouling to Improve Plant Availability...… https://t.co/W6mG1AUeRz,2
Mazda issues recall over Takata airbag inflators again,2
McDonald : Statement of Changes in Beneficial Ownership #McDonalds #Stock #MarketScreener https://t.co/wenQ4xK31f https://t.co/UhFOTIt5dx,2
McDonald’s is expected to launch a crispy chicken sandwich in the beginning of next year and Telsey Advisory Group… https://t.co/VEzN1thrUs,2
McDonald's Tells Investors to Expect More Cash Returns,2
McEwen Mining plans stock offering; size not disclosed,2
McEwen Mining prices public offering at $1.325/unit,2
MDU Resources outlines five-year $2.9B capex plan,2
"MEC Resources : Takeovers Panel makes no interim order, meeting to proceed #MECResources #Stock #MarketScreener… https://t.co/4xZZdesCFj",2
MedAdvisor : Lapsing of Hook Options & Appendix 3Y #MedAdvisor #Stock #MarketScreener https://t.co/wvYCXWn47T https://t.co/NxsdR97hBR,2
Mediaset Espana Comunicacion S A : announces an Extraordinary Shareholders Meeting to be h... #Stock… https://t.co/PIweWD4Gm6,2
Memebox Rebrands to MBX and Names New Executive Team,2
Merit Medical : Launches ReSolve Mini&trade; Locking Drainage Catheter #MeritMedical #Stock #MarketScreener… https://t.co/vwM769hibZ,2
Metal Bank : Managing Director's Presentation to Shareholders #MetalBank #Stock #MarketScreener… https://t.co/xgnjVQORWf,2
Metminco : 1st Hole at Chuscal Intersects Impressive 350m Gold Interval #Metminco #Stock #MarketScreener… https://t.co/aUSyAHMHHg,2
"MGA Entertainment knows that LOL Surprise toys are creating massive amounts of plastic waste, and now they're tryin… https://t.co/HbsmDO26VD",2
MGE Energy Issues December 2019 &apos;Interim Report&apos;,2
MHI Selected for Inclusion in All Four GPIF ESG Investment Indices for a Second Consecutive Year,2
MICROmega : Sebata - empowerment transaction #MICROmega #Stock #MarketScreener https://t.co/DTjCG1iCeU https://t.co/slUU3Dauaa,2
"Micron Analysts Expect Lukewarm Q1, But Project Coming Inflection In Memory Pricing",2
"Microsoft is pushing back the launch of its new Surface Earbuds, meaning it will miss the crucial 2019 holiday shop… https://t.co/BNKhQQE930",2
Microsoft just launched its new #HoloLens2 augmented reality headset. While it's not quite ready for store shelves… https://t.co/xNW4bldQUc,2
Microsoft updates terms on data privacy amid EU probe,2
"Microsoft, Baker Hughes announce artificial intelligence partnership for oil and gas industry… https://t.co/xAwr4V7LSJ",2
