text,label
Honduras - DRM Development Policy Credit with a Catastrophe Deferred Drawdown Option (Cat DDO) #economy… https://t.co/ZsxtwAt8FS,2
IMF African Department Director Abebe Aemro Selassie will be on @CNBCAfrica today at 5pm Lagos Time (12pm DC Time)… https://t.co/xMWhTEke42,2
IMF and World Bank consider #Somalia eligible for debt relief on initial assessment. This is an important milestone… https://t.co/mnGkqZxsWb,2
IMF to continue new-loan talks with Ukraine in coming weeks #economy #MarketScreener https://t.co/z7E36jR1i8 https://t.co/MQQ8AxnaGI,2
"In ""Unprecedented"" Move To Ease Conditions, ECB Cuts Collateral Haircuts By 20%, Will Accept Greek Debt As Collater… https://t.co/SU2jKATE3I",2
"In first #MENA emergency financing, the IMF approved US$745 million to support #Tunisia's efforts to address the hu… https://t.co/j5dfvZCBza",2
India Unveils Steps for Bad Loan-Laden Banks to Boost Credit,2
Indonesia’s central bank sounded a more cautious tone on interest rates https://t.co/XvYExp61ZH,2
Inflation remains low and Fed Chairman Jerome Powell has as good as ruled out a rate increase unless price growth p… https://t.co/EMQ6vAOo55,2
Interest rate conditions of the Magyar Nemzeti Bank effective from 8 April 2020 #economy #MarketScreener… https://t.co/LtgoxFiEBO,2
"It may seem odd for the Federal Reserve to buy ETFs, but it's not unprecedented for a central bank -œ Japan did it f… https://t.co/Tm7u3av8zC",2
"It was 7 years ago that Jerome Powell said ""we look like we are blowing a fixed-income duration bubble right across… https://t.co/eJHWtlyGo4",2
"Italian banks ready new measures as economy stops, but debt goes on https://t.co/ZMrEl3ZDOL https://t.co/AB8Hpn3BLN",2
"James Bullard, President of the Federal Reserve Bank of St. Louis, discusses the Federal Reserve's ""planned tempora… https://t.co/NEVONwysvh",2
Japan panel warns against fiscal complacency amid low rates #taux #MarketScreener https://t.co/bgHBLjLZaW https://t.co/6F4t7RytXF,2
Jerome Powell told lawmakers Tuesday that the Fed will never declare victory on one of its mandates: full employment https://t.co/lnEGDrhUln,2
Kenya Cuts Rates After Scrapping Loan-Price Cap to Boost Growth,2
Kenya’s central bank lowers interest rates for the first time in 16 months https://t.co/7SQ003stA9,2
Kenya’s central bank lowers interest rates for the first time in 16 months https://t.co/yQpS4kMTOD https://t.co/ExAA5O8fT1,2
Komileva: Central Banks Far from Normalizing,2
Lagarde Says All the Blame Can’t Be Dumped on ECB Negative Rates,2
Latin America Price Surprise Fails to Move the Dial on Rate Bets,2
Lawmakers interviewed gave Fed Chairman Jerome Powell high marks for his unwillingness to be drawn into a spat with... https://t.co/hHopJ74bbw,2
"Liquidity Warning: Fed Shrinks Overnight Repos By $20BN, Term Repos By $10BN | Zero Hedge https://t.co/NP2ocBHkvr",2
LIVE NOW: Press conference with #FOMC Chair Powell: https://t.co/sh1FXgYlwr and https://t.co/FJa6TbkDMt,2
LIVE: Fed Chair Jerome Powell delivers remarks at the decade's last FOMC meeting https://t.co/4wAYSuWpHF,2
"LIVE: Fed Chair Jerome Powell speaks on today's decision to hold rates ▶️

https://t.co/Wfg74SaImY",2
"Market participants submitted bids for nearly twice what was on offer in the Fed’s 42-day term repo operation, whic… https://t.co/qIqTKdQtpk",2
Mexico's central bank defends autonomy as AMLO concern lingers https://t.co/9CKZZc3uxq,2
"Monetary policy is in the 'right place', Fed's Williams says",2
"Monetary Policy Statement - March 24, 2020 (24.03.2020) #Stock #MarketScreener https://t.co/BkGvDXrRZL https://t.co/DaEOwqXxuI",2
Monetary Policy: Das’ Draghi Encore Comes With Risks,2
"Monetary Policy: RBI Returns To A More Active Credit Policy To Boost Retail,  MSME Credit",2
MPC Decision: MPC Keeps Rates On Hold Amid ‘Highly Uncertain’ Inflation Outlook,2
N.Y. FED'S 42-DAY REPO OP. OVERSUBSCRIBED; $49.05B OF BIDS,2
New BoE governor makes plea to Brussels on City access https://t.co/5X7rXAAsHG,2
New developments added to @FedFRASER's COVID-19 timeline in the latest week: second historic rise in unemployment i… https://t.co/o4yYfNRbhA,2
"New staff study by Kenneth Garbade examines the efforts of the Federal Open Market Committee to first control, and… https://t.co/seVxzGnVOu",2
New York Fed opens registration for commercial paper funding facility https://t.co/K5ZI55Mei5 https://t.co/eUnLPyar0E,2
New York Fed to further reduce repo support https://t.co/weKgRz0LMd https://t.co/UR8cWv9xZN,2
New York Fed to start publishing SOFR averages in March https://t.co/O0sIXhkddG,2
"New Zealand’s central bank doesn’t expect its new bank capital rules to present a headwind for the economy, which l… https://t.co/YXwseGIYHw",2
Next BoE governor makes City access plea to Brussels https://t.co/3HVBMfL9Ze,2
Norway's central bank governor warns politicians against meddling too much with the country's massive sovereign wea… https://t.co/H7bqZcQjoi,2
Now available: Weekly data on the Assets and Liabilities of Commercial Banks in the United States: https://t.co/Q478LdiYLB #FedData,2
"NY Fed Offers First Year-End Repo, Adds $93.5 Bln in Cash Banks Seek Liquidity
https://t.co/twaYHd2PDZ
@mdbaccardax",2
Off the 'QT': Does Federal Reserve nominee Judy Shelton have a balance sheet problem? https://t.co/masWFSb9oB https://t.co/RyPS7DYCC3,2
"Once we have more clarity about the new coronavirus outbreak, expect interest rates to rise, says Quicken Loans CEO… https://t.co/OOv4bsPKpX",2
Orr May Signal Readiness to Cut Rates as Virus Hits New Zealand's Economy,2
Parkmead : Bank of Jamaica 14-Day Repo Auction Announcement -25 November 2019 #Parkmead #Stock #MarketScreener… https://t.co/cMHuPB7ZFM,2
"Patrick Harker, President of the Philly Fed, is due to speak now.",2
PBOC Tells Property Speculators That ‘Homes Are For Living In’,2
PBOC Will Resolve Risks Gradually as Downward Pressure on Chinese Economy Has Increased #economy #MarketScreener… https://t.co/wMzcC38OfV,2
Peter Conti-Brown On The CARES Act And The Expanding Fed-Treasury Relationship In Response To COVID-19.… https://t.co/5rEILyYuNC,2
"Powell's 'half-full' U.S. glass sturdy but still at risk for spills as Fed meets
https://t.co/HPxoBCxi3B https://t.co/NQqEENkR6e",2
President Trump meets with Fed Chairman Powell to discuss economy,2
Press release on the Monetary Council meeting of 7 April 2020 #economy #MarketScreener https://t.co/vSMuCNmMuE https://t.co/13ghOSot3X,2
Property Lenders Surge After India Central Bank Eases Cash Rules,2
QE Infinity: So It Begins. https://t.co/HppY8KK3fV #business #stocks #stockmarket,2
Rate futures surge as coronavirus seen pushing Fed to ease https://t.co/Fi8x6k42Ap https://t.co/MPjtg6wicr,2
Read the latest FOMC statement https://t.co/VCPbCo6m61,2
"Regional Fed leaders favored holding rates steady for now, but that any worsening of novel coronavirus could affect… https://t.co/tcZzqWkz52",2
Rise of the intangibles is pushing down on central bank rates - BoE's Haskel https://t.co/3gYMZ51yzI https://t.co/yFeH07V30c,2
Robert Kaplan Says Fed Should Hold Barring ‘Material’ Change in Outlook,2
"Russia Delivers Sixth Straight Rate Cut, Signals Further Easing",2
"Russian and Romanian Rate Decisions, Commodity Chaos: Eco Day",2
Saudi Arabian Monetary Agency : SAMA Licenses HalalaH and BayanPay Companies #SaudiArabianMonetaryAgency #economy… https://t.co/mCmqEEmaP0,2
SBI Cuts MCLR-Based Lending Rates By 5 Basis Points Across Tenors,2
Sizing Up the Fed's Historic Coronavirus Crisis Intervention #Samp;P500 #economy #MarketScreener… https://t.co/o4qzaZPUeG,2
South African Reserve Bank : Regulatory relief measures and guidance to the banking sector...… https://t.co/kXm8dScZTn,2
St. Louis Fed President Jim Bullard recommends declaring a  “National Pandemic Adjustment Period' and discusses thre… https://t.co/o942U7BKPI,2
"Stock market live updates: Former Federal Reserve Chair Janet Yellen said the economy is in the throes of an ""absol… https://t.co/2xqOHCLmEe",2
Stock Market Update: President Trump meets with Fed Chair Powell,2
"Sweden's Riksbank underscores its commitment to zero interest rates, despite cutting its inflation forecast https://t.co/cqDzr8JVZ9",2
"Swedish central bank set to keep rates steady on Feb. 12, and through 2021: Reuters Poll",2
Thailand's central bank faces a fresh battle to contain the baht's strength,2
The Bank of England is launching an extra weekly liquidity facility after banks' demand for cash soared at its regu… https://t.co/N8q2VXLg5u,2
"The Bank of Israel extends its pause in interest rates, surprising most economists https://t.co/8lydT0Ph6e",2
The ECB dived into the fight to save the economy with 34 billion euros of bond purchases last week https://t.co/JNSEDvs9lt,2
The ECB ramped up its government bond buying program even before it boosted quantitative easing by an extra $805 bi… https://t.co/bYKZM2CTjP,2
The ECB will accept junk-rated Greek government bonds as collateral as part of wide-ranging measures to ease lender… https://t.co/8Kx1J07gTl,2
"The ECB will probably decide to take better account of home costs in its inflation measure, but there's unlikely to… https://t.co/Kg9elTbD90",2
The Fed and the Treasury will start buying debt issued by banks that lend through the government's small businesses… https://t.co/ZE7SV2CCmR,2
The Fed and Treasury Department are planning to launch a program to buy loans that financial firms make through the… https://t.co/DUUAXs3yzq,2
"The Fed announced a massive second wave of initiatives to support the U.S. economy, many specifically targeting com… https://t.co/6wgz15jypX",2
"The Fed announced new programs to help markets, the NYSE begins trading remotely today, and Trump activated the Nat… https://t.co/6QWlnqOWDy",2
The Fed Faces a Housing Conundrum,2
The Fed is going all in to try and ramp up the economy. Will it be enough? Insights via @CMEGroup https://t.co/BpEqm1utJ9,2
The Fed is going all in to try and ramp up the economy. Will it be enough? Insights via @CMEGroup https://t.co/RxmrkDKQOa,2
The Fed is going to buy ETFs. What does it mean? https://t.co/t0Gh4NVwfQ,2
The Fed Is Now Buying Investment Grade Bond ETFs Like LQD  https://t.co/ZQC24DFN3L,2
"The Fed is on hold for now, but it might not take much to change that",2
The Fed may be about to get a lot more involved in the bond market (via @bopinion) https://t.co/WxC8AWRRaS,2
The Fed plans to lend directly to companies outside the banking system. Former Fed Governor Narayana Kocherlakota s… https://t.co/WIJjtKBYJD,2
The Fed Says 'Helicopter Money' Is Here. https://t.co/JRqmtSRtbf #stocks #business #stockmarket,2
The Fed sidesteps a bickering Congress with sweeping rescue plan https://t.co/SBxYPhDR2q,2
The Fed took the lid off QE. Here's how the central bank has been responding to the coronavirus crisis… https://t.co/z51VeD10Tb,2
The Fed will create a new facility to help speed support to small businesses through the government's coronavirus s… https://t.co/M22EUfsoP9,2
The Fed will launch a barrage of programs aimed at helping markets function more efficiently in the wake of the cor… https://t.co/kSh6hJKgyo,2
The Fed’s interventions are aimed at ensuring that the financial system has enough liquidity and that short-term bo… https://t.co/cwaCeyj97h,2
The Federal Reserve assured the nation that the Central Bank has an essentially limitless ability to provide liquid… https://t.co/43Z7zVmKtL,2
The Federal Reserve Bank of New York added liquidity to financial markets Thursday in what is effectively a short-t… https://t.co/XWjrSLEXbj,2
The Federal Reserve is signaling it will do whatever it takes to save the coronavirus-ravaged American economy from… https://t.co/EB9feds0vx,2
"The Federal Reserve is wading into the $3.9 trillion municipal-bond market. 

But the central bank still has more l… https://t.co/CVR76uG6LQ",2
The Federal Reserve on Monday announced a massive second wave of initiatives to support a shuttered U.S. economy https://t.co/24MqL6jTmM,2
The Federal Reserve on Monday once again stepped in to shore up the lending market as it rolled out an array of pro… https://t.co/9U9ndPky3a,2
The Federal Reserve on Monday rolled out an extraordinary array of programs to backstop an economy reeling from res… https://t.co/uCAEJ41Rzs,2
"The Federal Reserve took more extraordinary measures to keep the economy from seizing up, but it can't soften the b… https://t.co/SsvXAyhVr3",2
The Fed's Emergence as a Power Player Poses New Risks to Its Independence #economy #MarketScreener… https://t.co/hwe3xwwGma,2
"The IMF has three main roles: economic policy advice, lending, and capacity development. How did we serve our 189 m… https://t.co/XreOyj15Bu",2
The IMF is providing emergency financial assistance to member countries facing the economic impact of the #COVID19… https://t.co/Vu7rLIfpN7,2
The IMF may launch a new program that could back up the Fed's campaign to keep dollars flowing in the global economy https://t.co/wOOa8e7wX6,2
The IMF says that Uganda will spend as much as a fifth of government revenue on interest payments https://t.co/upwkLxCclO,2
"The man about to become Britain's top central banker says the U.K. should be free to change its own rules, ahead of… https://t.co/K7CYXMDfaf",2
"The New York Fed said it will shrink its repurchase agreement operations further, starting with Friday's overnight… https://t.co/eAhxhyAocY",2
"The NY Fed said it accepted $25 billion in bids, from a total of $49 billion placed at the central bank  https://t.co/qmdK6LGP1t",2
The quarterly handoff in Treasury shorts is riskier than normal https://t.co/BlFNMTJ4Pw,2
The Russian government tapped its sovereign wealth fund to purchase the central bank's 50% holding in the country's… https://t.co/XNbtGWFcog,2
"The St. Louis Fed is proud to assist @USTreasury in presenting Your Guide to America’s Finances, an annual snapshot… https://t.co/1VqagVX5ok",2
The stricken Bank of Jinzhou will unload $21 billion of assets to the central bank for less than a third of theirÃ‚Â r… https://t.co/xGuCP9lBlH,2
The target for the overnight interbank funding rate is decreased by 25 basis points #Stock #MarketScreener… https://t.co/pUpRxfyNco,2
"The U.S. should declare a 3-month break for nonessential businesses, says St. Louis Fed president https://t.co/vsE3wjGyHk",2
"The worst scramble for cash is happening in an opaque corner of the market, where the Fed has little control, write… https://t.co/1ZddVnhX3j",2
"Today, the IMF Executive Board approved a disbursement of €176.5 million to #NorthMacedonia. This financial suppor… https://t.co/hloz3ZRGNH",2
Traders are now trying to get ahead of the Fed's purchases https://t.co/UTF5phTB1V,2
Traders Maintain Amount of Fed Easing Seen in 2020 After Jobs,2
Trump doubles down on lower rates at Powell meeting,2
"Trump says he talked about interest rates, dollar strength with Powell",2
Tunisia eyes IMF talks in March on sixth review of loan deal -minister #economy #MarketScreener… https://t.co/9eio1gEMyk,2
Turkey is trying to stop emergency loans intended to boost its economy during the coronavirus slowdown from fueling… https://t.co/EcSwShpQGl,2
Two Regional Fed Chiefs Lay Out Aggressive Coronavirus Response -- Update #economy #MarketScreener… https://t.co/9OUm67AaSL,2
Two top BOE officials suggested that the UK financial system's rules may have to diverge from the EU's after Brexit https://t.co/85NEJl6fLm,2
"U.S. banks cram for Fed risk test, with ripple effects in repo #economy #MarketScreener https://t.co/Hvz8lXjRl0 https://t.co/Dg0f2nRHHP",2
"U.S. Fed buys $427 million of mortgage bonds, sells none https://t.co/ezA4AiwOlC https://t.co/z4h3yRWGTj",2
U.S. to Block Iran's Request to IMF for $5 Billion Loan to Fight Coronavirus -- Update #economy #MarketScreener… https://t.co/n3Crpty48r,2
"U.S. Treasury, Fed working on 'Main Street,' municipal loan facilities - Mnuchin #economy #MarketScreener… https://t.co/xlHUAdkJG9",2
UK banks' dollar demand rises to $3.555 billion: BoE repo operation https://t.co/D5YDDpaj13 https://t.co/licT21042C,2
UK watchdog gauging how virus affects plan to retire Libor https://t.co/B1wWDKFasL https://t.co/3ZDXFQvGtE,2
US Fed admits Libra has potential to ‘rapidly’ achieve mass adoption,2
US Treasury To Ask For $200 Billion More In Small Business Loans https://t.co/MpQKXdG9Xt,2
Vital conversations happen all around the Eighth Federal Reserve District. One of the ways we listen is through our… https://t.co/tsLMen6MSn,2
Watch Fed Chairman Jerome Powell's news conference live https://t.co/AbOHHqlbeA,2
Watch Live: Fed Chair Powell Avoid Admitting QE4 Has Begun & Repocalypse Is Imminent https://t.co/BlKwurqscz,2
WATCH: Fed Chair Powell holds a press conference following the FOMC's unanimous decision to leave interest rates un… https://t.co/od2QG12LGo,2
"'We know that there will be very likely some effects on the United States', said the Fed chairman Jay Powell about… https://t.co/eAeVR5GUm2",2
Well laid plans at the Federal Reserve keep getting blown off course by the trade war (via @RichMiller28 &… https://t.co/ESn0p1N19h,2
What the Fed meeting minutes could say about interest rates that Powell didn't say,2
What to look for when Fed Chair Powell meets with Congress this week,2
Will the Fed provide any stimulus to the U.S. economy? Look to the equities market for clues. Insights via @CMEGroup https://t.co/zk1s08F1zW,2
"With coronavirus ravaging the US economy, the Federal Reserve may have to get creative. CNN Business'… https://t.co/wqKtHN3mVC",2
"With latest moves, Fed becomes creditor in chief for U.S. business #economy #MarketScreener https://t.co/LjIQ3iMwmv https://t.co/CY4JHRFSxb",2
World Bank could deploy $150 billion over 15 months in coronavirus battle - Malpass #economy #MarketScreener… https://t.co/lU5FmuUBUa,2
World Bank Suggests Creating ‘Brand Northeast’,2
"Yellen says the Fed doesn't need to buy equities now, but Congress should reconsider allowing it https://t.co/ms6Y9qvmUK",2
Zimbabwe Central Bank Reverses Policy and Halves Key Rate to 35%,2
"""I’ve owned the Apple Card for 3 months…this is why it sucks."" https://t.co/ngzSpdvFPK",0
"""That's Not Safe! Somebody's Going To Die!"": Senator Markey Slams Tesla Autopilot At Commerce Committee Hearing https://t.co/PHvFLxKnQu",0
"""We Totally Failed As A Business"": Unicorn Scooter Impales Investors After Company Goes Hooves-Up https://t.co/otp1fQAFgj",0
"$300,000 Pilot Jobs Drying Up in China After Boeing Grounding",0
$AAL - American halts flights to Mainland China https://t.co/zQIKTbqqUk,0
$AMGN - Partial response in Amgen brain cancer study https://t.co/6sAXBkTCST,0
$AXAS - Abraxas Petroleum: Poor Liquidity Points To A Chapter 11 May Be On The Horizon. https://t.co/bdKkXTKDOL… https://t.co/PG849ZPziP,0
$AXAS - Abraxas Petroleum: Poor Liquidity Points To A Chapter 11 May Be On The Horizon. https://t.co/bdKkXTKDOLâ€¦ https://t.co/PG849ZPziP,0
$BA - 737 MAX crisis claims job of Boeing's top communications official https://t.co/FwntvthN9F,0
$CAT - Caterpillar sees more weak demand ahead as firms defer capital decisions https://t.co/CzAxE8TDL1,0
$CBAY: CymaBay Therapeutics halts clinical development of Seladelpar based on initial histological findings observe… https://t.co/v8K1pQPrsK,0
$CORV - FDA advisory committee thumbs down on Correvio's Brinavess for AF https://t.co/vLfvDUDw9v,0
$CTSO: CytoSorbents says temporarily pausing enrollment of REFRESH 2-AKI study at the recommendation of its Data... https://t.co/6ibg4NhPh1,0
$LJPC - La Jolla Pharma to reassess development of LJPC-401 https://t.co/sJITlHYGuz,0
$LK - Citron and Muddy Waters at odds over Luckin Coffeee https://t.co/gkLLQ0bBQA,0
$UBER - Uber CEO comments on London license loss https://t.co/ppLtG1r4lP,0
$UN $UL - Unilever U.S. recalls some chicken products https://t.co/jLN7s2LAd7,0
"“Vaping is taking us backward,” CVS Health CEO Larry Merlo says. “Something has to be done.” https://t.co/CwxbCtXvWW https://t.co/NBv10IejXx",0
2020 Will Be Another Year of Pain for Tanger,0
"After Growing 16% In 2 Years, Why Did Lowe’s Number Of Stores Decrease?",0
Airbus : Boeing deliveries halved in first eleven months of 2019 #Airbus #Stock #MarketScreener… https://t.co/5Ux2IqpCAP,0
Apple closing all China stores and offices,0
"Apple saw China iPhone units fall in November, Credit Suisse says",0
"As a reminder, JPMorgan remains the riskiest bank with the highest GSIB score of any bank and a 4.0% surcharge. https://t.co/8jTxnywzqM",0
"As Liquidation Threat Looms, Jet Airways Bidders Still Not Ready",0
Axonics launches $110M equity offering; shares down 3% after hours,0
BlackRock admonishes Siemens for environmental actions,0
Boeing deliveries halved in first eleven months of 2019 https://t.co/aNHnf3f89F https://t.co/LHeC37Q814,0
Boeing Forced to Halt 737 MAX Production,0
Boeing to suspend 737 Max production in January,0
"Boeing, suppliers slip as Wall Street counts MAX halt costs",0
"Boeing's halt to 737 MAX production could ding U.S. economy, jobs",0
Breaking - United $UAL suspends flights to China as coronavirus outbreak continues,0
Bristol-Myers' Opdivo + Yervoy disappoints in melanoma study,0
Bumble Bee files for bankruptcy after $25 million fine for tuna price fixing https://t.co/nLaDnUUmKh,0
"Bumble Bee Foods filed for bankruptcy, blaming its ""recent and significant legal challenges."" https://t.co/kFYH8KrLKA",0
Burberry says coronavirus hurting luxury demand,0
Burberry Says Viral Epidemic Devastates China Sales,0
BW Group trims its stake in DHT Holdings,0
California department to reject Sezzle's application for lending license in state,0
Canadian National Laying Off Workers,0
Carmakers close Chinese factories because of coronavirus,0
China’s Coronavirus Set To Dampen Economic Growth In The United States,0
Coronavirus reports hang over cruise line sector,0
CORRECT: Tapestry estimates 2020 negative impact of $200 mln-$250 mln from coronavirus outbreak in China,0
"CORRECTED-Nissan recalls nearly 400,000 vehicles over braking system defect (Nov. 16)",0
Credit Suisse's Top Investor Wants Chairman to Follow CEO Out,0
Delta and American airlines halt flights to China in response to coronavirus https://t.co/XtxOndVRIg,0
"Delta has decided to temporarily suspend all flights from the US to China from February 6 through April 30, due to... https://t.co/vJLfdbPhvV",0
Disney+ faces backlash over 'The Simpsons' aspect ratio,0
DNA testing company Veritas Genetics is suspending American operations and cutting all U.S. staff after a financing… https://t.co/LZZNsdU41T,0
Efforts to save South African Airways by placing it into bankruptcy protection hit a snag https://t.co/ptXgcTsac7,0
Electrolux to incur $70 million charge for U.S. overhaul,0
Expedia's Problems Run Deeper Than SEO Headwinds,0
Facebook under fire as political ads vanish from archive: FT https://t.co/4gXYZZSiWR https://t.co/NIfMVvmsj3,0
Factbox: Automakers close factories in China due to virus outbreak,0
Finnair cancels 276 flights as unions join solidarity strike #FinnairOyj #Stock #MarketScreener… https://t.co/j4PMDAs2cI,0
"Ford Recalls More Than 500,000 Pickups for Fire Risk",0
Ford risks Mustang fan backlash with SUV: They'll need to pry gas-powered Mustangs from 'my cold dead fingers',0
Frozen Wells Fargo Bonuses Show a Peril for Bankers After Crisis,0
"FTC's Look Into Facebook A 'Negative Development,' Says RBC's Mahaney",0
Gilead's Second CAR-T Treatment Suffers the Same Issues as Yescarta,0
Goldman partner embroiled in 1MDB scandal exits bank - FT https://t.co/uiXjEqyc6e https://t.co/cV1UlIMIB4,0
"Gulfport Energy to stop share buybacks, cut jobs; Houston to leave board",0
Harvest Health becomes latest cannabis company to scale back a previously-agreed deal,0
"Hexo's Q1 Report Could Be Ugly, Says Cantor Fitzgerald",0
Honda may keep Wuhan plants closed longer due to outbreak: Nikkei,0
"Hong Kong Airlines to cut 400 jobs, ask employees to take unpaid leave: SCMP",0
"Hong Kong Airlines to cut 400 jobs, operations as coronavirus hits travel",0
"Hyundai Motor, Kia Motors to keep Chinese factories idled until February 16",0
IFA Irish Farmers Association : HAND IN LETTERS OF PROTEST TO MEAT INDUSTRY IRELAND AND MI... #IFA #economy… https://t.co/xxnZ8OgPnG,0
"In a sharply worded letter, HP told Xerox it has “significant concerns about both the near-term health and long-ter… https://t.co/xYlMfujdGg",0
"ING's Fourth-Quarter Results Were Quite Challenging, Says CFO",0
J.C. Penney Again at Risk Of NYSE Delisting,0
Jaguar Land Rover to cut output at two UK factories,0
La Jolla Pharma to reassess development of LJPC-401,0
La Jolla Pharmaceutical to reassess continued development of LJPC-401 based on clinical results,0
Lifeblood of Amazon merchants threatened as coronavirus infects Chinese workers,0
Loonie dips as Bank of Canada official points out uncertainties,0
L'Oreal CEO says coronavirus will hamper sales in coming weeks,0
L'Oreal Expects Short-Term Virus Hit,0
Lowe's says it will shut 34 stores in Canada,0
Luckin Coffee and Yum China hit again by coronavirus anxiety,0
"Macy's says weather, soft tourism and weak performance at lower-tier malls weighed in Q3",0
"Mitsubishi postpones SpaceJet delivery again, books $4.5 billion special loss",0
"Nike to record $425 mln charge as it transitions brand business in Brazil, Argentina, Chile, Uruguay to distributor partnerships",0
Nike Warns Coronavirus Is Presuring Sales in China,0
Nintendo Switch Shipments to Japan Delayed by Coronavirus,0
Nissan orders deep spending cuts - Reuters,0
Novartis to cut 150 jobs at Shanghai site in shift to commercial development,0
NTSB calls on Boeing to redesign thousands of 737s,0
NTSB chair criticizes Uber's safety culture,0
Nutrien : to Shut Down Rocanville Mine for Two Weeks Due to CN Strike #Nutrien #Stock #MarketScreener… https://t.co/7RnmPSYg3X,0
